{
  "contract": "AYO-RQC-1",
  "commit_sha": "0000000000000000000000000000000000000000",
  "workflow_run": "UNRESOLVED",
  "classification": "ENGINEERING_CERTIFICATION_EVIDENCE",
  "tool_versions": {
    "gitleaks": "8.30.1",
    "postgresql_postgis_image": "postgis/postgis:17-3.6-alpine@sha256:88c78b602e7f2340ed46a090b78c96e9291d249517d50ea03a1cafb82d33ebe2"
  },
  "commands": [],
  "artifacts": [],
  "gate_results": {},
  "review": {
    "project_cto_status": "PENDING",
    "founder_status": "PENDING",
    "production_status": "NOT_APPROVED"
  }
}
